{
  "format": "animageo-board/v1",
  "boundingbox": [
    -15.172623,
    8.093504,
    14.70965,
    -8.715275
  ],
  "size": [
    853,
    708
  ],
  "chrome": {
    "axis": false,
    "grid": false,
    "background": "#FFFFFF",
    "axesColor": "#1C1C1F",
    "gridColor": "#B4B3BA",
    "showXAxis": false,
    "showYAxis": false,
    "keepAspectRatio": true,
    "gridBold": false,
    "gridStep": null,
    "xShowNumbers": true,
    "yShowNumbers": true,
    "xTickDistance": null,
    "yTickDistance": null
  },
  "options": {
    "mathjax": true,
    "showNavigation": true,
    "jsxgraphVersion": "1.10.1",
    "divId": "agbox"
  },
  "inputs": [
    {
      "name": "E",
      "kind": "point",
      "x": -1.6545345774625366,
      "y": -5.339686455597624
    },
    {
      "name": "F",
      "kind": "point",
      "x": 4.781833088253054,
      "y": -3.323900977873521
    },
    {
      "name": "N",
      "kind": "point",
      "x": 0.5118120944166731,
      "y": -3.0406572528653366
    }
  ],
  "elements": [
    {
      "name": "E",
      "role": "input",
      "kind": "point",
      "engine": "point",
      "parents": [
        -1.6545,
        -5.3397
      ],
      "attrs": {
        "strokeColor": "#000000",
        "fillColor": "#1565C0",
        "strokeWidth": 1.0,
        "fillOpacity": 1.0,
        "layer": 9,
        "name": "\\(E\\)",
        "withLabel": true,
        "label": {
          "useMathJax": true,
          "strokeColor": "#1565C0"
        },
        "size": 5,
        "face": "o"
      },
      "detail": "free point"
    },
    {
      "name": "F",
      "role": "input",
      "kind": "point",
      "engine": "point",
      "parents": [
        4.7818,
        -3.3239
      ],
      "attrs": {
        "strokeColor": "#000000",
        "fillColor": "#1565C0",
        "strokeWidth": 1.0,
        "fillOpacity": 1.0,
        "layer": 9,
        "name": "\\(F\\)",
        "withLabel": true,
        "label": {
          "useMathJax": true,
          "strokeColor": "#1565C0"
        },
        "size": 5,
        "face": "o"
      },
      "detail": "free point"
    },
    {
      "name": "N",
      "role": "input",
      "kind": "point",
      "engine": "point",
      "parents": [
        0.5118,
        -3.0407
      ],
      "attrs": {
        "strokeColor": "#000000",
        "fillColor": "#1565C0",
        "strokeWidth": 1.0,
        "fillOpacity": 1.0,
        "layer": 9,
        "name": "\\(N\\)",
        "withLabel": true,
        "label": {
          "useMathJax": true,
          "strokeColor": "#1565C0"
        },
        "size": 5,
        "face": "o"
      },
      "detail": "free point"
    },
    {
      "name": "f",
      "role": "static",
      "kind": "Line",
      "engine": "line",
      "parents": [
        [
          -4.8576,
          -8.7153
        ],
        [
          3.5468,
          8.0935
        ]
      ],
      "attrs": {
        "strokeColor": "#6E6D73",
        "fillColor": "#FFFFFF",
        "strokeWidth": 2.5,
        "strokeOpacity": 0.8,
        "fillOpacity": 1.0,
        "layer": 6,
        "withLabel": false
      },
      "detail": "Line (direct)"
    },
    {
      "name": "g",
      "role": "static",
      "kind": "Conic",
      "engine": "curve",
      "parents": [
        [
          -3.0155,
          -3.0095,
          -3.0034,
          -2.9973,
          -2.9912,
          -2.9851,
          -2.9791,
          -2.973,
          -2.9669,
          -2.9608,
          -2.9547,
          -2.9487,
          -2.9426,
          -2.9365,
          -2.9304,
          -2.9243,
          -2.9183,
          -2.9122,
          -2.9061,
          -2.9,
          -2.8939,
          -2.8879,
          -2.8818,
          -2.8696,
          -2.8575,
          -2.8453,
          -2.8332,
          -2.821,
          -2.8088,
          -2.7967,
          -2.7845,
          -2.7724,
          -2.7602,
          -2.748,
          -2.7359,
          -2.7237,
          -2.7116,
          -2.6994,
          -2.6872,
          -2.6751,
          -2.6629,
          -2.6508,
          -2.6386,
          -2.6264,
          -2.6143,
          -2.6021,
          -2.59,
          -2.5778,
          -2.5656,
          -2.5535,
          -2.5413,
          -2.5292,
          -2.517,
          -2.5048,
          -2.4927,
          -2.4805,
          -2.4684,
          -2.4562,
          -2.444,
          -2.4319,
          -2.4197,
          -2.4076,
          -2.3954,
          -2.3833,
          -2.3711,
          -2.3589,
          -2.3468,
          -2.3346,
          -2.3225,
          -2.3103,
          -2.2981,
          -2.286,
          -2.2738,
          -2.2617,
          -2.2495,
          -2.2373,
          -2.2252,
          -2.213,
          -2.2009,
          -2.1887,
          -2.1765,
          -2.1644,
          -2.1522,
          -2.1401,
          -2.1279,
          -2.1157,
          -2.1036,
          -2.0914,
          -2.0793,
          -2.0671,
          -2.0549,
          -2.0428,
          -2.0306,
          -2.0185,
          -2.0063,
          -1.9941,
          -1.982,
          -1.9698,
          -1.9577,
          -1.9455,
          -1.9334,
          -1.9212,
          -1.909,
          -1.8969,
          -1.8847,
          -1.8726,
          -1.8604,
          -1.8482,
          -1.8361,
          -1.8239,
          -1.8118,
          -1.7996,
          -1.7874,
          -1.7753,
          -1.7631,
          -1.751,
          -1.7388,
          -1.7266,
          -1.7145,
          -1.7023,
          -1.6902,
          -1.678,
          -1.6658,
          -1.6537,
          -1.6415,
          -1.6294,
          -1.6172,
          -1.605,
          -1.5929,
          -1.5807,
          -1.5686,
          -1.5564,
          -1.5443,
          -1.5321,
          -1.5199,
          -1.5078,
          -1.4956,
          -1.4835,
          -1.4713,
          -1.4591,
          -1.447,
          -1.4348,
          -1.4227,
          -1.4105,
          -1.3983,
          -1.3862,
          -1.3619,
          -1.3375,
          -1.3132,
          -1.2889,
          -1.2646,
          -1.2403,
          -1.2159,
          -1.1916,
          -1.1673,
          -1.143,
          -1.1187,
          -1.0944,
          -1.07,
          -1.0457,
          -1.0214,
          -0.9971,
          -0.9728,
          -0.9484,
          -0.9241,
          -0.8998,
          -0.8755,
          -0.8512,
          -0.8268,
          -0.8025,
          -0.7782,
          -0.7539,
          -0.7296,
          -0.7052,
          -0.6809,
          -0.6566,
          -0.6323,
          -0.608,
          -0.5837,
          -0.5593,
          -0.535,
          -0.4864,
          -0.4377,
          -0.3891,
          -0.3405,
          -0.2918,
          -0.2432,
          -0.1946,
          -0.1459,
          -0.0973,
          -0.0486,
          0,
          0.0486,
          0.0973,
          0.1459,
          0.1946,
          0.2432,
          0.2918,
          0.3405,
          0.3891,
          0.4377,
          0.4864,
          0.535,
          0.5593,
          0.5837,
          0.608,
          0.6323,
          0.6566,
          0.6809,
          0.7052,
          0.7296,
          0.7539,
          0.7782,
          0.8025,
          0.8268,
          0.8512,
          0.8755,
          0.8998,
          0.9241,
          0.9484,
          0.9728,
          0.9971,
          1.0214,
          1.0457,
          1.07,
          1.0944,
          1.1187,
          1.143,
          1.1673,
          1.1916,
          1.2159,
          1.2403,
          1.2646,
          1.2889,
          1.3132,
          1.3375,
          1.3619,
          1.3862,
          1.3983,
          1.4105,
          1.4227,
          1.4348,
          1.447,
          1.4591,
          1.4713,
          1.4835,
          1.4956,
          1.5078,
          1.5199,
          1.5321,
          1.5443,
          1.5564,
          1.5686,
          1.5807,
          1.5929,
          1.605,
          1.6172,
          1.6294,
          1.6415,
          1.6537,
          1.6658,
          1.678,
          1.6902,
          1.7023,
          1.7145,
          1.7266,
          1.7388,
          1.751,
          1.7631,
          1.7753,
          1.7874,
          1.7996,
          1.8118,
          1.8239,
          1.8361,
          1.8482,
          1.8604,
          1.8726,
          1.8847,
          1.8969,
          1.909,
          1.9212,
          1.9334,
          1.9455,
          1.9577,
          1.9698,
          1.982,
          1.9941,
          2.0063,
          2.0185,
          2.0306,
          2.0428,
          2.0549,
          2.0671,
          2.0793,
          2.0914,
          2.1036,
          2.1157,
          2.1279,
          2.1401,
          2.1522,
          2.1644,
          2.1765,
          2.1887,
          2.2009,
          2.213,
          2.2252,
          2.2373,
          2.2495,
          2.2617,
          2.2738,
          2.286,
          2.2981,
          2.3103,
          2.3225,
          2.3346,
          2.3468,
          2.3589,
          2.3711,
          2.3833,
          2.3954,
          2.4076,
          2.4197,
          2.4319,
          2.444,
          2.4562,
          2.4684,
          2.4805,
          2.4927,
          2.5048,
          2.517,
          2.5292,
          2.5413,
          2.5535,
          2.5656,
          2.5778,
          2.59,
          2.6021,
          2.6143,
          2.6264,
          2.6386,
          2.6508,
          2.6629,
          2.6751,
          2.6872,
          2.6994,
          2.7116,
          2.7237,
          2.7359,
          2.748,
          2.7602,
          2.7724,
          2.7845,
          2.7967,
          2.8088,
          2.821,
          2.8332,
          2.8453,
          2.8575,
          2.8696,
          2.8818,
          2.8879,
          2.8939,
          2.9,